{
  "scenario_id": "a1b2c3d4-5e6f-4a7b-8c9d-0e1f2a3b4c5d",
  "name": "England, 1492",
  "start_date": "1492-08-01",
  "calendar": "gregorian",
  "geo_pack": {
    "id": "world_1492",
    "version": "1"
  },
  "player_nation_id": "b3c2fda1-4e6b-4c7f-8a2b-2d9a1e2f3b4c",
  "nations": [
    {
      "nation_id": "b3c2fda1-4e6b-4c7f-8a2b-2d9a1e2f3b4c",
      "name": "England",
      "tag": "ENG",
      "government_type": "monarchy",
      "capital_geo_region_id": "58f2374e-2f08-5db5-b227-1c05d2e30750"
    },
    {
      "nation_id": "d6a1f2b3-9c4d-4a8b-9e1f-3c2b1a0d9e8f",
      "name": "France",
      "tag": "FRA",
      "government_type": "monarchy",
      "capital_geo_region_id": "0d53afa3-c109-5745-9758-6c81d583da3c"
    }
  ],
  "relations": [
    {
      "from_nation_id": "b3c2fda1-4e6b-4c7f-8a2b-2d9a1e2f3b4c",
      "to_nation_id": "d6a1f2b3-9c4d-4a8b-9e1f-3c2b1a0d9e8f",
      "value": -32,
      "treaties": [
        "etaples_1492"
      ],
      "at_war": false
    },
    {
      "from_nation_id": "d6a1f2b3-9c4d-4a8b-9e1f-3c2b1a0d9e8f",
      "to_nation_id": "b3c2fda1-4e6b-4c7f-8a2b-2d9a1e2f3b4c",
      "value": -28,
      "treaties": [
        "etaples_1492"
      ],
      "at_war": false
    }
  ],
  "region_assignments": [
    {
      "geo_region_id": "58f2374e-2f08-5db5-b227-1c05d2e30750",
      "nation_id": "b3c2fda1-4e6b-4c7f-8a2b-2d9a1e2f3b4c",
      "geo_region_key": "england-london"
    },
    {
      "geo_region_id": "1b8f1ac9-7985-5edd-8c46-ba2e21c6967f",
      "nation_id": "b3c2fda1-4e6b-4c7f-8a2b-2d9a1e2f3b4c",
      "geo_region_key": "england-kent"
    },
    {
      "geo_region_id": "1d4c92f1-f33c-5abb-9819-922d617f8b12",
      "nation_id": "b3c2fda1-4e6b-4c7f-8a2b-2d9a1e2f3b4c",
      "geo_region_key": "england-wessex"
    },
    {
      "geo_region_id": "234f379a-51b6-5a41-ada1-eb417a6597f7",
      "nation_id": "b3c2fda1-4e6b-4c7f-8a2b-2d9a1e2f3b4c",
      "geo_region_key": "england-york"
    },
    {
      "geo_region_id": "95cb0fe2-122a-554f-81c9-890931708b36",
      "nation_id": "b3c2fda1-4e6b-4c7f-8a2b-2d9a1e2f3b4c",
      "geo_region_key": "england-cornwall"
    },
    {
      "geo_region_id": "0d53afa3-c109-5745-9758-6c81d583da3c",
      "nation_id": "d6a1f2b3-9c4d-4a8b-9e1f-3c2b1a0d9e8f",
      "geo_region_key": "france-paris"
    },
    {
      "geo_region_id": "219d114a-54d3-5031-b50a-724a4cd64aea",
      "nation_id": "d6a1f2b3-9c4d-4a8b-9e1f-3c2b1a0d9e8f",
      "geo_region_key": "france-normandy"
    },
    {
      "geo_region_id": "880b9a9b-76d4-5fe9-a018-5be4e7deae5c",
      "nation_id": "d6a1f2b3-9c4d-4a8b-9e1f-3c2b1a0d9e8f",
      "geo_region_key": "france-brittany"
    }
  ],
  "nation_snapshots": [
    {
      "nation_id": "b3c2fda1-4e6b-4c7f-8a2b-2d9a1e2f3b4c",
      "gdp": 5200000,
      "tax_rate": 0.28,
      "tax_capacity": 0.55,
      "compliance": 0.7,
      "treasury": 42000,
      "debt": 8000,
      "stability": 63,
      "legitimacy": 72,
      "population": 2400000,
      "literacy": 0.18,
      "admin_capacity": 52,
      "corruption": 0.22,
      "manpower_pool": 78000,
      "force_size": 18000,
      "readiness": 0.62,
      "supply": 0.58,
      "war_exhaustion": 8,
      "tech_level_mil": 38,
      "laws": [
        "royal_council",
        "feudal_dues"
      ],
      "institutions": {
        "tax_office": 3,
        "navy_board": 2
      },
      "culture_mix": {
        "english": 0.92,
        "welsh": 0.08
      },
      "religion_mix": {
        "catholic": 0.99,
        "lollard": 0.01
      }
    },
    {
      "nation_id": "d6a1f2b3-9c4d-4a8b-9e1f-3c2b1a0d9e8f",
      "gdp": 8200000,
      "tax_rate": 0.32,
      "tax_capacity": 0.6,
      "compliance": 0.62,
      "treasury": 31000,
      "debt": 25000,
      "stability": 55,
      "legitimacy": 68,
      "population": 4200000,
      "literacy": 0.14,
      "admin_capacity": 47,
      "corruption": 0.28,
      "manpower_pool": 110000,
      "force_size": 28000,
      "readiness": 0.58,
      "supply": 0.52,
      "war_exhaustion": 12,
      "tech_level_mil": 40,
      "laws": [
        "estates_general"
      ],
      "institutions": {
        "tax_office": 4,
        "standing_army": 2
      },
      "culture_mix": {
        "french": 0.9,
        "breton": 0.06,
        "norman": 0.04
      },
      "religion_mix": {
        "catholic": 0.98,
        "other": 0.02
      }
    }
  ],
  "province_snapshots": [
    {
      "geo_region_id": "58f2374e-2f08-5db5-b227-1c05d2e30750",
      "nation_id": "b3c2fda1-4e6b-4c7f-8a2b-2d9a1e2f3b4c",
      "population": 190000,
      "productivity": 8.2,
      "infrastructure": 7.6,
      "unrest": 18,
      "compliance_local": 0.82,
      "garrison": 4000,
      "resources": [
        "commerce",
        "textiles"
      ],
      "culture_mix": {
        "english": 0.95,
        "welsh": 0.05
      },
      "religion_mix": {
        "catholic": 0.99,
        "lollard": 0.01
      },
      "geo_region_key": "england-london"
    },
    {
      "geo_region_id": "1b8f1ac9-7985-5edd-8c46-ba2e21c6967f",
      "nation_id": "b3c2fda1-4e6b-4c7f-8a2b-2d9a1e2f3b4c",
      "population": 140000,
      "productivity": 6.8,
      "infrastructure": 6.2,
      "unrest": 22,
      "compliance_local": 0.78,
      "garrison": 2200,
      "resources": [
        "shipbuilding",
        "grain"
      ],
      "culture_mix": {
        "english": 0.96,
        "welsh": 0.04
      },
      "religion_mix": {
        "catholic": 0.99,
        "lollard": 0.01
      },
      "geo_region_key": "england-kent"
    },
    {
      "geo_region_id": "1d4c92f1-f33c-5abb-9819-922d617f8b12",
      "nation_id": "b3c2fda1-4e6b-4c7f-8a2b-2d9a1e2f3b4c",
      "population": 210000,
      "productivity": 6.4,
      "infrastructure": 5.8,
      "unrest": 14,
      "compliance_local": 0.83,
      "garrison": 2600,
      "resources": [
        "grain",
        "wool"
      ],
      "culture_mix": {
        "english": 0.93,
        "welsh": 0.07
      },
      "religion_mix": {
        "catholic": 0.99,
        "lollard": 0.01
      },
      "geo_region_key": "england-wessex"
    },
    {
      "geo_region_id": "234f379a-51b6-5a41-ada1-eb417a6597f7",
      "nation_id": "b3c2fda1-4e6b-4c7f-8a2b-2d9a1e2f3b4c",
      "population": 170000,
      "productivity": 6,
      "infrastructure": 5.4,
      "unrest": 26,
      "compliance_local": 0.71,
      "garrison": 2400,
      "resources": [
        "iron",
        "wool"
      ],
      "culture_mix": {
        "english": 0.92,
        "welsh": 0.08
      },
      "religion_mix": {
        "catholic": 0.98,
        "lollard": 0.02
      },
      "geo_region_key": "england-york"
    },
    {
      "geo_region_id": "95cb0fe2-122a-554f-81c9-890931708b36",
      "nation_id": "b3c2fda1-4e6b-4c7f-8a2b-2d9a1e2f3b4c",
      "population": 120000,
      "productivity": 5.2,
      "infrastructure": 4.8,
      "unrest": 33,
      "compliance_local": 0.64,
      "garrison": 1800,
      "resources": [
        "tin",
        "fish"
      ],
      "culture_mix": {
        "english": 0.88,
        "welsh": 0.12
      },
      "religion_mix": {
        "catholic": 0.99,
        "lollard": 0.01
      },
      "geo_region_key": "england-cornwall"
    },
    {
      "geo_region_id": "0d53afa3-c109-5745-9758-6c81d583da3c",
      "nation_id": "d6a1f2b3-9c4d-4a8b-9e1f-3c2b1a0d9e8f",
      "population": 220000,
      "productivity": 8.1,
      "infrastructure": 7.2,
      "unrest": 16,
      "compliance_local": 0.76,
      "garrison": 5200,
      "resources": [
        "commerce",
        "textiles"
      ],
      "culture_mix": {
        "french": 0.93,
        "norman": 0.07
      },
      "religion_mix": {
        "catholic": 0.98,
        "other": 0.02
      },
      "geo_region_key": "france-paris"
    },
    {
      "geo_region_id": "219d114a-54d3-5031-b50a-724a4cd64aea",
      "nation_id": "d6a1f2b3-9c4d-4a8b-9e1f-3c2b1a0d9e8f",
      "population": 180000,
      "productivity": 6.5,
      "infrastructure": 5.9,
      "unrest": 20,
      "compliance_local": 0.7,
      "garrison": 3000,
      "resources": [
        "shipbuilding",
        "grain"
      ],
      "culture_mix": {
        "french": 0.86,
        "norman": 0.14
      },
      "religion_mix": {
        "catholic": 0.98,
        "other": 0.02
      },
      "geo_region_key": "france-normandy"
    },
    {
      "geo_region_id": "880b9a9b-76d4-5fe9-a018-5be4e7deae5c",
      "nation_id": "d6a1f2b3-9c4d-4a8b-9e1f-3c2b1a0d9e8f",
      "population": 150000,
      "productivity": 5.6,
      "infrastructure": 5.1,
      "unrest": 24,
      "compliance_local": 0.68,
      "garrison": 2400,
      "resources": [
        "salt",
        "fish"
      ],
      "culture_mix": {
        "french": 0.82,
        "breton": 0.18
      },
      "religion_mix": {
        "catholic": 0.98,
        "other": 0.02
      },
      "geo_region_key": "france-brittany"
    }
  ],
  "characters": [
    {
      "character_id": "c1111111-2222-4b33-8c44-555555555555",
      "name": "Henry VII",
      "title": "King of England",
      "portrait_prompt": "stern Tudor king in dark velvet, wary eyes",
      "bio": "A cautious monarch consolidating the Tudor claim after years of civil strife.",
      "traits": [
        "ruler",
        "cautious"
      ],
      "skills": {
        "diplomacy": 62,
        "finance": 71,
        "war": 48,
        "interior": 54,
        "intrigue": 57,
        "admin": 66
      },
      "advisor_model": {
        "accuracy": 0.35,
        "reliability": 0.8,
        "bias": {},
        "scope": {}
      },
      "loyalties": {
        "b3c2fda1-4e6b-4c7f-8a2b-2d9a1e2f3b4c": 0.95
      }
    },
    {
      "character_id": "c2222222-3333-4c44-9d55-666666666666",
      "name": "Arthur Tudor",
      "title": "Prince of Wales",
      "bio": "Young heir to the Tudor dynasty, raised for a diplomatic future.",
      "traits": [
        "heir"
      ],
      "skills": {
        "diplomacy": 45,
        "finance": 36,
        "war": 28,